{"generated_at":"2026-10-25T19:34:35Z","schema_version":1,"tactics":{"T1055.011":["privilege-escalation","stealth"],"T1053.005":["execution","persistence","privilege-escalation"],"T1205.002":["command-and-control","persistence","stealth"],"T1560.001":["collection"],"T1021.005":["lateral-movement"],"T1047":["execution"],"T1687":["defense-impairment"],"T1113":["collection"],"T1027.011":["stealth"],"T1037":["persistence","privilege-escalation"],"T1557":["collection","credential-access"],"T1033":["discovery"],"T1583":["resource-development"],"T1218.011":["stealth"],"T1613":["discovery"],"T1583.007":["resource-development"],"T1132.001":["command-and-control"],"T1027.009":["stealth"],"T1556.003":["credential-access","defense-impairment","persistence"],"T1578.004":["defense-impairment"],"T1592":["reconnaissance"],"T1596.003":["reconnaissance"],"T1056.001":["collection","credential-access"],"T1564.012":["stealth"],"T1222.002":["defense-impairment"],"T1110.001":["credential-access"],"T1216.001":["stealth"],"T1597.002":["reconnaissance"],"T1003":["credential-access"],"T1129":["execution"],"T1602":["collection"],"T1561.002":["impact"],"T1498.001":["impact"],"T1574.007":["execution","stealth"],"T1213.002":["collection"],"T1006":["stealth"],"T1588.007":["resource-development"],"T1666":["defense-impairment"],"T1564.008":["stealth"],"T1491.002":["impact"],"T1027.013":["stealth"],"T1590.005":["reconnaissance"],"T1499.001":["impact"],"T1014":["stealth"],"T1546.013":["persistence","privilege-escalation"],"T1059.007":["execution"],"T1685.003":["defense-impairment"],"T1590.002":["reconnaissance"],"T1485.001":["impact"],"T1123":["collection"],"T1543":["persistence","privilege-escalation"],"T1133":["initial-access","persistence"],"T1546.006":["persistence","privilege-escalation"],"T1539":["credential-access"],"T1053.007":["execution","persistence","privilege-escalation"],"T1568.002":["command-and-control"],"T1036.007":["stealth"],"T1548.002":["privilege-escalation"],"T1496.003":["impact"],"T1016.001":["discovery"],"T1548.003":["privilege-escalation"],"T1685.001":["defense-impairment"],"T1682":["reconnaissance"],"T1560.003":["collection"],"T1578":["defense-impairment"],"T1584.008":["resource-development"],"T1583.008":["resource-development"],"T1069":["discovery"],"T1114":["collection"],"T1003.002":["credential-access"],"T1596.002":["reconnaissance"],"T1542.001":["persistence","stealth"],"T1594":["reconnaissance"],"T1069.003":["discovery"],"T1574.011":["execution","stealth"],"T1596.001":["reconnaissance"],"T1499.003":["impact"],"T1195.001":["initial-access"],"T1588.004":["resource-development"],"T1583.002":["resource-development"],"T1561":["impact"],"T1071.004":["command-and-control"],"T1552.005":["credential-access"],"T1555.002":["credential-access"],"T1615":["discovery"],"T1542.003":["persistence","stealth"],"T1025":["collection"],"T1218.013":["stealth"],"T1074.001":["collection"],"T1036.005":["stealth"],"T1587.003":["resource-development"],"T1565.001":["impact"],"T1110.002":["credential-access"],"T1114.001":["collection"],"T1555.001":["credential-access"],"T1547":["persistence","privilege-escalation"],"T1003.004":["credential-access"],"T1600":["defense-impairment"],"T1606.002":["credential-access"],"T1036.008":["stealth"],"T1489":["impact"],"T1587.001":["resource-development"],"T1652":["discovery"],"T1087.002":["discovery"],"T1547.014":["persistence","privilege-escalation"],"T1564":["stealth"],"T1559.002":["execution"],"T1204.002":["execution"],"T1591.003":["reconnaissance"],"T1685.004":["defense-impairment"],"T1071.005":["command-and-control"],"T1592.001":["reconnaissance"],"T1080":["lateral-movement"],"T1484.002":["defense-impairment","privilege-escalation"],"T1213.006":["collection"],"T1573.001":["command-and-control"],"T1087.001":["discovery"],"T1586.001":["resource-development"],"T1176.001":["persistence"],"T1542.005":["persistence","stealth"],"T1686.003":["defense-impairment"],"T1543.003":["persistence","privilege-escalation"],"T1568.001":["command-and-control"],"T1497.001":["discovery","stealth"],"T1053.003":["execution","persistence","privilege-escalation"],"T1069.002":["discovery"],"T1588.006":["resource-development"],"T1566.002":["initial-access"],"T1499.004":["impact"],"T1137":["persistence"],"T1218.004":["stealth"],"T1598.003":["reconnaissance"],"T1021.004":["lateral-movement"],"T1098.003":["persistence","privilege-escalation"],"T1547.012":["persistence","privilege-escalation"],"T1566.001":["initial-access"],"T1027.008":["stealth"],"T1559.001":["execution"],"T1574.001":["execution","stealth"],"T1119":["collection"],"T1689":["defense-impairment"],"T1115":["collection"],"T1003.007":["credential-access"],"T1583.005":["resource-development"],"T1555.005":["credential-access"],"T1553.001":["defense-impairment"],"T1675":["execution"],"T1608.004":["resource-development"],"T1007":["discovery"],"T1040":["credential-access","discovery"],"T1553.002":["defense-impairment"],"T1530":["collection"],"T1565.003":["impact"],"T1552.002":["credential-access"],"T1135":["discovery"],"T1120":["discovery"],"T1036.009":["stealth"],"T1590.004":["reconnaissance"],"T1587.002":["resource-development"],"T1222.001":["defense-impairment"],"T1137.006":["persistence"],"T1685.002":["defense-impairment"],"T1505.002":["persistence"],"T1082":["discovery"],"T1071":["command-and-control"],"T1574.014":["execution","stealth"],"T1074.002":["collection"],"T1098.006":["persistence","privilege-escalation"],"T1053":["execution","persistence","privilege-escalation"],"T1218.007":["stealth"],"T1590.003":["reconnaissance"],"T1498.002":["impact"],"T1556.002":["credential-access","defense-impairment","persistence"],"T1505.005":["persistence"],"T1059.002":["execution"],"T1176":["persistence"],"T1499.002":["impact"],"T1195.003":["initial-access"],"T1106":["execution"],"T1558.005":["credential-access"],"T1070.007":["stealth"],"T1558.004":["credential-access"],"T1584.003":["resource-development"],"T1059.010":["execution"],"T1600.001":["defense-impairment"],"T1070.003":["stealth"],"T1202":["stealth"],"T1091":["initial-access","lateral-movement"],"T1005":["collection"],"T1140":["stealth"],"T1137.005":["persistence"],"T1586.003":["resource-development"],"T1586.002":["resource-development"],"T1098.007":["persistence","privilege-escalation"],"T1608.001":["resource-development"],"T1195":["initial-access"],"T1190":["initial-access"],"T1558":["credential-access"],"T1555":["credential-access"],"T1567":["exfiltration"],"T1219":["command-and-control"],"T1583.001":["resource-development"],"T1560.002":["collection"],"T1055.003":["privilege-escalation","stealth"],"T1684":["stealth"],"T1036":["stealth"],"T1546.011":["persistence","privilege-escalation"],"T1552":["credential-access"],"T1547.010":["persistence","privilege-escalation"],"T1070.008":["stealth"],"T1037.002":["persistence","privilege-escalation"],"T1659":["command-and-control","initial-access"],"T1055":["privilege-escalation","stealth"],"T1567.004":["exfiltration"],"T1205":["command-and-control","persistence","stealth"],"T1021.008":["lateral-movement"],"T1218":["stealth"],"T1070.006":["stealth"],"T1557.004":["collection","credential-access"],"T1620":["stealth"],"T1016.002":["discovery"],"T1480.002":["stealth"],"T1564.011":["stealth"],"T1611":["privilege-escalation"],"T1518.002":["discovery"],"T1547.009":["persistence","privilege-escalation"],"T1010":["discovery"],"T1569.003":["execution"],"T1087.003":["discovery"],"T1497.003":["discovery","stealth"],"T1218.003":["stealth"],"T1563.001":["lateral-movement"],"T1029":["exfiltration"],"T1021.002":["lateral-movement"],"T1525":["persistence"],"T1572":["command-and-control"],"T1218.002":["stealth"],"T1599.001":["defense-impairment"],"T1608.002":["resource-development"],"T1547.005":["persistence","privilege-escalation"],"T1036.011":["stealth"],"T1550":["lateral-movement"],"T1597.001":["reconnaissance"],"T1011":["exfiltration"],"T1602.002":["collection"],"T1589":["reconnaissance"],"T1560":["collection"],"T1553.003":["defense-impairment"],"T1185":["collection"],"T1021":["lateral-movement"],"T1071.003":["command-and-control"],"T1556.007":["credential-access","defense-impairment","persistence"],"T1595.002":["reconnaissance"],"T1059.009":["execution"],"T1596":["reconnaissance"],"T1218.015":["stealth"],"T1207":["defense-impairment"],"T1553.006":["defense-impairment"],"T1610":["execution"],"T1112":["defense-impairment","persistence"],"T1543.004":["persistence","privilege-escalation"],"T1580":["discovery"],"T1555.003":["credential-access"],"T1574.008":["execution","stealth"],"T1491":["impact"],"T1535":["stealth"],"T1557.003":["collection","credential-access"],"T1563":["lateral-movement"],"T1564.013":["stealth"],"T1027.001":["stealth"],"T1505.003":["persistence"],"T1484.001":["defense-impairment","privilege-escalation"],"T1685.006":["defense-impairment"],"T1217":["discovery"],"T1552.004":["credential-access"],"T1583.004":["resource-development"],"T1021.006":["lateral-movement"],"T1011.001":["exfiltration"],"T1078.001":["initial-access","persistence","privilege-escalation","stealth"],"T1547.003":["persistence","privilege-escalation"],"T1546.005":["persistence","privilege-escalation"],"T1574.006":["execution","stealth"],"T1136.001":["persistence"],"T1681":["reconnaissance"],"T1674":["execution"],"T1092":["command-and-control"],"T1585.002":["resource-development"],"T1557.001":["collection","credential-access"],"T1222":["defense-impairment"],"T1003.001":["credential-access"],"T1176.002":["persistence"],"T1595":["reconnaissance"],"T1027.016":["stealth"],"T1548":["privilege-escalation"],"T1134.002":["privilege-escalation","stealth"],"T1548.001":["privilege-escalation"],"T1547.004":["persistence","privilege-escalation"],"T1021.003":["lateral-movement"],"T1110.003":["credential-access"],"T1090.002":["command-and-control"],"T1056.003":["collection","credential-access"],"T1589.002":["reconnaissance"],"T1598.004":["reconnaissance"],"T1683.001":["resource-development"],"T1003.005":["credential-access"],"T1098